{
  "schema_version": "1.1",
  "subject": "POP MART INTERNATIONAL GROUP LIMITED (09992.HK)",
  "as_of": "2026-08-02",
  "primary_market_scope_fingerprint": "02991581f41fcf59e5785f9e641f782b1fbe3673f5fd7ae939b7deab010a06df",
  "status": "publishable-with-gaps",
  "roles": [
    {
      "role": "market-definition",
      "claim_ids": ["popmart.market-definition"],
      "claim_states": [
        {"claim_id": "popmart.market-definition", "state": "accepted"}
      ],
      "state": "accepted",
      "accepted_evidence_count": 1,
      "required_periods": [],
      "accepted_periods": [],
      "missing_periods": [],
      "missing_coverage": [],
      "market_definition_fingerprints": [
        "02991581f41fcf59e5785f9e641f782b1fbe3673f5fd7ae939b7deab010a06df"
      ],
      "scope_fingerprints": [],
      "lineage_ids": ["frost-sullivan-top-toy-2026"],
      "series": [],
      "ledger_paths": [
        "/Users/brian_huang/repos/ah-research-popmart-profile/data/filings/09992.HK/research/source-index.md"
      ],
      "gap_reason": null,
      "not_applicable_reason": null
    },
    {
      "role": "historical-market-size",
      "claim_ids": ["popmart.market-size.2021-2025"],
      "claim_states": [
        {"claim_id": "popmart.market-size.2021-2025", "state": "accepted"}
      ],
      "state": "accepted",
      "accepted_evidence_count": 5,
      "required_periods": ["2021", "2022", "2023", "2024", "2025"],
      "accepted_periods": ["2021", "2022", "2023", "2024", "2025"],
      "missing_periods": [],
      "missing_coverage": [],
      "market_definition_fingerprints": [
        "02991581f41fcf59e5785f9e641f782b1fbe3673f5fd7ae939b7deab010a06df"
      ],
      "scope_fingerprints": [
        "1bf03ca8051715f4d6425a59c1ebd7bad2a82b8092a1f2ca3f6e64a00ed0798c"
      ],
      "lineage_ids": ["frost-sullivan-top-toy-2026"],
      "series": [
        {
          "series_id": "china-pop-toy-gmv-history-2021-2025",
          "market_definition_fingerprint": "02991581f41fcf59e5785f9e641f782b1fbe3673f5fd7ae939b7deab010a06df",
          "series_fingerprint": "1bf03ca8051715f4d6425a59c1ebd7bad2a82b8092a1f2ca3f6e64a00ed0798c",
          "metric": "market size",
          "unit": "CNY billion",
          "measurement_basis": "GMV",
          "channel_scope": "all retail channels",
          "denominator": "total China pop toy market GMV",
          "period_semantics": "calendar-year",
          "value_status": "historical-estimate",
          "periods": ["2021", "2022", "2023", "2024", "2025"],
          "published_at": "2026-03-31",
          "data_vintage": "2026-03-31",
          "lineage_id": "frost-sullivan-top-toy-2026"
        }
      ],
      "ledger_paths": [
        "/Users/brian_huang/repos/ah-research-popmart-profile/data/filings/09992.HK/research/source-index.md"
      ],
      "gap_reason": null,
      "not_applicable_reason": null
    },
    {
      "role": "industry-forecast",
      "claim_ids": [
        "popmart.forecast.2026-2030",
        "popmart.forecast.2026-2030:prior-vintage",
        "popmart.forecast.2026-2030:later-vintage"
      ],
      "claim_states": [
        {"claim_id": "popmart.forecast.2026-2030", "state": "accepted"},
        {"claim_id": "popmart.forecast.2026-2030:prior-vintage", "state": "exhausted"},
        {"claim_id": "popmart.forecast.2026-2030:later-vintage", "state": "exhausted"}
      ],
      "state": "partial",
      "accepted_evidence_count": 5,
      "required_periods": ["2026", "2027", "2028", "2029", "2030"],
      "accepted_periods": ["2026", "2027", "2028", "2029", "2030"],
      "missing_periods": [],
      "missing_coverage": [
        "No prior forecast vintage using the same GMV series fingerprint",
        "No later forecast vintage published by AS_OF"
      ],
      "market_definition_fingerprints": [
        "02991581f41fcf59e5785f9e641f782b1fbe3673f5fd7ae939b7deab010a06df"
      ],
      "scope_fingerprints": [
        "1bf03ca8051715f4d6425a59c1ebd7bad2a82b8092a1f2ca3f6e64a00ed0798c"
      ],
      "lineage_ids": ["frost-sullivan-top-toy-2026"],
      "series": [
        {
          "series_id": "china-pop-toy-gmv-forecast-2026-2030",
          "market_definition_fingerprint": "02991581f41fcf59e5785f9e641f782b1fbe3673f5fd7ae939b7deab010a06df",
          "series_fingerprint": "1bf03ca8051715f4d6425a59c1ebd7bad2a82b8092a1f2ca3f6e64a00ed0798c",
          "metric": "market size",
          "unit": "CNY billion",
          "measurement_basis": "GMV",
          "channel_scope": "all retail channels",
          "denominator": "total China pop toy market GMV",
          "period_semantics": "calendar-year",
          "value_status": "forecast",
          "periods": ["2026", "2027", "2028", "2029", "2030"],
          "published_at": "2026-03-31",
          "data_vintage": "2026-03-31",
          "lineage_id": "frost-sullivan-top-toy-2026"
        }
      ],
      "ledger_paths": [
        "/Users/brian_huang/repos/ah-research-popmart-profile/data/filings/09992.HK/research/source-index.md"
      ],
      "gap_reason": "Version chase found an older RSV forecast but no comparable prior GMV vintage; no later publication existed by AS_OF.",
      "not_applicable_reason": null
    },
    {
      "role": "market-concentration",
      "claim_ids": ["popmart.cr5.2025"],
      "claim_states": [
        {"claim_id": "popmart.cr5.2025", "state": "accepted"}
      ],
      "state": "accepted",
      "accepted_evidence_count": 1,
      "required_periods": ["2025"],
      "accepted_periods": ["2025"],
      "missing_periods": [],
      "missing_coverage": [],
      "market_definition_fingerprints": [
        "02991581f41fcf59e5785f9e641f782b1fbe3673f5fd7ae939b7deab010a06df"
      ],
      "scope_fingerprints": [
        "c81861862636780705e4dbfb10a13fd4e2dfa2b88bdb4b6d911de38ff2f89fda"
      ],
      "lineage_ids": ["frost-sullivan-top-toy-2026"],
      "series": [
        {
          "series_id": "china-pop-toy-cr5-2025",
          "market_definition_fingerprint": "02991581f41fcf59e5785f9e641f782b1fbe3673f5fd7ae939b7deab010a06df",
          "series_fingerprint": "c81861862636780705e4dbfb10a13fd4e2dfa2b88bdb4b6d911de38ff2f89fda",
          "metric": "CR5",
          "unit": "percent",
          "measurement_basis": "GMV",
          "channel_scope": "all retail channels",
          "denominator": "total China pop toy market GMV",
          "period_semantics": "calendar-year",
          "value_status": "historical-estimate",
          "periods": ["2025"],
          "published_at": "2026-03-31",
          "data_vintage": "2026-03-31",
          "lineage_id": "frost-sullivan-top-toy-2026"
        }
      ],
      "ledger_paths": [
        "/Users/brian_huang/repos/ah-research-popmart-profile/data/filings/09992.HK/research/source-index.md"
      ],
      "gap_reason": null,
      "not_applicable_reason": null
    },
    {
      "role": "subject-market-share",
      "claim_ids": [
        "popmart.share.2021",
        "popmart.share.2022",
        "popmart.share.2023",
        "popmart.share.2024",
        "popmart.share.2025"
      ],
      "claim_states": [
        {"claim_id": "popmart.share.2021", "state": "accepted"},
        {"claim_id": "popmart.share.2022", "state": "exhausted"},
        {"claim_id": "popmart.share.2023", "state": "exhausted"},
        {"claim_id": "popmart.share.2024", "state": "exhausted"},
        {"claim_id": "popmart.share.2025", "state": "accepted"}
      ],
      "state": "partial",
      "accepted_evidence_count": 2,
      "required_periods": ["2021", "2022", "2023", "2024", "2025"],
      "accepted_periods": ["2021", "2025"],
      "missing_periods": ["2022", "2023", "2024"],
      "missing_coverage": [
        "2022 public evidence uses retail value rather than the primary GMV series",
        "2023 company-level share not found",
        "2024 public evidence uses RSV rather than the primary GMV series"
      ],
      "market_definition_fingerprints": [
        "02991581f41fcf59e5785f9e641f782b1fbe3673f5fd7ae939b7deab010a06df"
      ],
      "scope_fingerprints": [
        "2194cb85a7cc5cf91f30050261228d656b176c81bdc02b60fb84be6ab1362aae"
      ],
      "lineage_ids": [
        "frost-sullivan-miniso-2022",
        "frost-sullivan-top-toy-2026"
      ],
      "series": [
        {
          "series_id": "pop-mart-gmv-share-2021",
          "market_definition_fingerprint": "02991581f41fcf59e5785f9e641f782b1fbe3673f5fd7ae939b7deab010a06df",
          "series_fingerprint": "2194cb85a7cc5cf91f30050261228d656b176c81bdc02b60fb84be6ab1362aae",
          "metric": "company market share",
          "unit": "percent",
          "measurement_basis": "GMV",
          "channel_scope": "all retail channels",
          "denominator": "total China pop toy market GMV",
          "period_semantics": "calendar-year",
          "value_status": "historical-estimate",
          "periods": ["2021"],
          "published_at": "2022-06-30",
          "data_vintage": "2022-06-30",
          "lineage_id": "frost-sullivan-miniso-2022"
        },
        {
          "series_id": "pop-mart-gmv-share-2025",
          "market_definition_fingerprint": "02991581f41fcf59e5785f9e641f782b1fbe3673f5fd7ae939b7deab010a06df",
          "series_fingerprint": "2194cb85a7cc5cf91f30050261228d656b176c81bdc02b60fb84be6ab1362aae",
          "metric": "company market share",
          "unit": "percent",
          "measurement_basis": "GMV",
          "channel_scope": "all retail channels",
          "denominator": "total China pop toy market GMV",
          "period_semantics": "calendar-year",
          "value_status": "historical-estimate",
          "periods": ["2025"],
          "published_at": "2026-03-31",
          "data_vintage": "2026-03-31",
          "lineage_id": "frost-sullivan-top-toy-2026"
        }
      ],
      "ledger_paths": [
        "/Users/brian_huang/repos/ah-research-popmart-profile/data/filings/09992.HK/research/source-index.md"
      ],